id;name;description;price;image;category;subcategory
1;Cadeira Atenas;Cadeira super confortável;100;/images/cadeira-atenas.svg;Sala de Estar;Cadeiras
2;Sofá Melissa;Sofá amplo e confortável;2000;/images/sofa-melissa.svg;Sala de Estar;Sofás
3;Rack Aurora;Rack elegante para a sala de TV;450;/images/rack-aurora.svg;Sala de Estar;Racks
4;Mesa de Jantar Tupia;Mesa ideal para refeições em família;720;/images/mesa-de-jantar-tupia.svg;Sala de Jantar;Mesas
5;Poltrona Karina;Poltrona com design moderno;1200;/images/poltrona-karina.svg;Sala de Estar;Poltronas
